query,answer,response,eval_scores,guardrails_triggered,judge_ruling,judge_reasoning
i flew with frontier 2 days ago and forgot to add my frontier miles number. how long should i wait for miles to post and what do i do if they dont?,"Wait up to 3 business days from your flight date for miles to post automatically. If they aren’t posted after 3 business days, log in to your FRONTIER Miles account and enter your 6‑digit confirmation code in the “Add Trips” box on your profile (you must be a registered FRONTIER Miles member). The ticket name must exactly match the name on your account. Once you add the missing trip, miles will post to your account within 24–48 business hours. You can also add your FRONTIER Miles number to the reservation via FlyFrontier.com (My Trip > Change Name Details) or the Frontier mobile app (My Trips > Manage My Booking > Passenger Card). If you’re not yet a member, join first to add the trip.","You should wait up to 3 business days from your flight date for your FRONTIER Miles to appear in your account. If the miles haven't posted after this period, you can manually add the missing flights by logging into your FRONTIER Miles account and entering your flight confirmation code in the “Add Trips” section on your profile page.

Ensure that the name on your ticket matches exactly with the name on your FRONTIER Miles account to receive credit. Once you add the missing flights, the miles should post to your account within 24-48 business hours.

If you need further assistance, you can chat with Frontier Airlines for help.","{""query_ease"": 0.9965174128088667, ""brand_safety"": 0.996517412936989, ""trustworthiness"": 0.9989999017213032, ""topic_restriction"": 0.9965174129367574, ""context_sufficiency"": 0.9965174129354039, ""suspicious_activity"": 0.9965174129370998, ""response_helpfulness"": 0.9965174129364476, ""response_groundedness"": 0.9965174129354035}",[],pass,"The agent output matches the expected guidance: it instructs to wait up to 3 business days, explains how to add the missing trip by logging into the FRONTIER Miles account and entering the confirmation code in “Add Trips,” notes the ticket-name match requirement, and states miles should post within 24–48 business hours. It does not contradict the expected answer (additional methods and joining first are optional details). Therefore the output meets the criteria."
can i skip the airport line if i have a mobile boarding pass?,"Having a mobile boarding pass can help streamline your airport experience, but it doesn't allow you to skip all lines. Here's how it can help:

1. **Check-In**: You can check in online and download your mobile boarding pass, which means you can skip the check-in counter if you don't have checked baggage.

2. **Security**: You will still need to go through the standard security screening process. Having a mobile boarding pass doesn't allow you to bypass security lines.
","Having a mobile boarding pass can help streamline your airport experience, but it doesn't allow you to skip all lines. Here's how it can help:

1. **Check-In**: You can check in online and download your mobile boarding pass, which means you can skip the check-in counter if you don't have checked baggage.

2. **Security**: You will still need to go through the standard security screening process. Having a mobile boarding pass doesn't allow you to bypass security lines.

3. **Boarding**: With a mobile boarding pass, you can proceed directly to the gate and board the plane when your group is called, without needing to print a paper boarding pass.

If you're looking to expedite your airport experience further, consider programs like TSA PreCheck, which can provide access to faster security lines.","{""query_ease"": 0.9963412299342991, ""brand_safety"": 0.8877847732456885, ""trustworthiness"": 0.8681399757930383, ""topic_restriction"": 0.872387169251101, ""context_sufficiency"": 0.001, ""suspicious_activity"": 0.9965174127533926, ""response_helpfulness"": 0.99651741293702, ""response_groundedness"": 0.001}",[],pass,"The agent output answers the question, stating that a mobile boarding pass can let you skip the check-in counter if you have no checked baggage and that you still must go through security. It does not contradict the expected answer and includes allowable extra details (boarding and TSA PreCheck). Therefore it meets all criteria."
how do i view my mobile boarding pass in the Frontier app and what info do i need to access it?,"Download the Frontier Airlines mobile app (iOS or Android), open the app and tap My Trip. Enter your Last Name and your Confirmation Code (a 6-character combination of letters and numbers) and click Search. Your itinerary will appear there; the boarding pass becomes available after you check in.","To view your mobile boarding pass in the Frontier Airlines app, follow these steps:

1. **Download the App**: Ensure you have the Frontier Airlines app installed on your mobile device. It's available for both [iOS](https://itunes.apple.com/us/app/frontier-airlines/id1041410548?mt=8) and [Android](https://play.google.com/store/apps/details?id=com.flyfrontier.android&hl=en).

2. **Open the App**: Launch the Frontier Airlines app on your device.

3. **Access My Trip**: Tap on the **My Trip** section within the app.

4. **Enter Your Details**: You will need to enter your **Last Name** and **Confirmation Code**. The confirmation code is a 6-character combination of letters and numbers.

5. **Search and Check-In**: After entering your details, click **Search**. Your itinerary will be displayed, and you can access your boarding pass after completing the check-in process.

Once you have your mobile boarding pass, if you're not checking a bag and only have a carry-on, you can proceed directly to the gate.","{""query_ease"": 0.9965174129356955, ""brand_safety"": 0.9965174129356089, ""trustworthiness"": 0.9989997996053825, ""topic_restriction"": 0.9965174129363985, ""context_sufficiency"": 0.9965174129354472, ""suspicious_activity"": 0.9965174129388368, ""response_helpfulness"": 0.9965174129362391, ""response_groundedness"": 0.9965174129357913}",[],pass,"The agent output directly answers the query by giving clear steps matching the expected answer: download the Frontier app (iOS/Android), open it and go to My Trip, enter Last Name and Confirmation Code (noting it is a 6-character alphanumeric code), click Search to view itinerary, and that the mobile boarding pass becomes available after check-in. It does not contradict the expected answer and any extra info (e.g., carry-on note) is acceptable. Therefore it meets all criteria."
how long do i have to report a damaged checked bag?,"Report damage within 4 hours of arrival to a Frontier representative at the airport. If you could not report it at the airport, submit a claim through the Damaged Baggage Form. If possible, show the bag to an agent so they can assess the damage and advise next steps. If the agent determines Frontier was responsible, we will proceed from there. For more detail on what we are not liable for, see the Contract of Carriage under 'Limitations of Liability'.","If your checked bag arrives damaged, you need to report the damage to a Frontier representative at the airport within 4 hours of arrival. If you are unable to do so at the airport, you can submit a claim through the Damaged Baggage Form online. It's important to show the bag to an agent if possible, as they will assess the damage and determine the next steps. Keep in mind that Frontier is not liable for normal wear and tear or if the bag was overstuffed beyond its capacity.","{""query_ease"": 0.9965174128826045, ""brand_safety"": 0.9965174129164377, ""trustworthiness"": 0.9989999017213032, ""topic_restriction"": 0.9965174129362658, ""context_sufficiency"": 0.9965174124897073, ""suspicious_activity"": 0.996517412937346, ""response_helpfulness"": 0.9965174096336341, ""response_groundedness"": 0.9965174129354679}",[],pass,"The agent output directly answers the query: it instructs customers to report damaged checked bags to a Frontier representative at the airport within 4 hours of arrival, provides the alternative of submitting a Damaged Baggage Form if unable to report at the airport, advises showing the bag to an agent for assessment and next steps, and notes liability limits. This matches the expected answer and does not contradict it. Therefore the output meets the criteria."
"i picked up my checked bag and it has scratches and a small tear, will frontier cover this and what should i do?","Frontier generally cannot be held liable for normal wear and tear, which the article explicitly lists to include scratches, small dents, rips, tears, and general grime and dirt, so scratches and a small tear are typically considered wear and tear and not covered. Still, you should report the damage within 4 hours of arrival to a Frontier representative at the airport and, if possible, show the bag to an agent so they can assess and determine responsibility. If you were unable to report at the airport, submit a claim through the Damaged Baggage Form. Note also that Frontier is not responsible for bags that were clearly overstuffed beyond capacity or for baggage carried in the passenger area (carry-on). If the agent determines Frontier was responsible despite the appearance of wear, we will proceed with next steps. For a detailed list of items we are not liable for, refer to the Contract of Carriage under 'Limitations of Liability'.","If your checked bag has scratches and a small tear, here's what you should do:

1. **Report the Damage:** You need to report the damage to a Frontier representative at the airport within 4 hours of your arrival.

2. **Submit a Claim:** If you were unable to report the damage at the airport, you can submit a claim through the [Damaged Baggage Form](https://app.nettracer.aero/pax/frontier/bso/login).

3. **Assessment:** Show the bag to an agent if possible. They will assess the damage and determine the next steps.

Please note that Frontier Airlines is not liable for normal wear and tear, which includes scratches, small dents, rips, tears, and general grime. If the damage is determined to be Frontier's responsibility, they will proceed with the necessary steps. For more details, you can refer to their [Contract of Carriage](https://www.flyfrontier.com/legal/contract-of-carriage/) under ‘Limitations of Liability’.","{""query_ease"": 0.9965174086948789, ""brand_safety"": 0.9965168515977846, ""trustworthiness"": 0.9837935462441896, ""topic_restriction"": 0.9965174129369341, ""context_sufficiency"": 0.9965172306217809, ""suspicious_activity"": 0.996517412936962, ""response_helpfulness"": 0.9965174117216526, ""response_groundedness"": 0.9965174129356307}",[],pass,"The agent output directly answers the user: it advises reporting damage to a Frontier representative within 4 hours, submitting the Damaged Baggage Form if unable to report at the airport, showing the bag for assessment, and states that scratches and small tears are generally considered normal wear and tear (not covered). It also references Frontier’s Contract of Carriage and notes that Frontier will proceed if the agent determines they are responsible. This matches the expected guidance and does not contradict the expected answer, so it meets the criteria."
can i mix standard and gowild fares on the same reservation?,"Yes. Different fare types (Standard, Discount Den, GoWild!) can be combined on a GoWild! reservation on a directional basis as long as all passengers hold a valid GoWild! Pass at the time of booking. If you select Discount Den fares, the primary passenger must also hold a Discount Den membership.","Yes, you can mix and match different types of fares, such as Standard and GoWild!, on the same reservation. However, all passengers must hold a valid GoWild! Pass at the time of booking. If Discount Den fares are selected, the primary passenger must also hold a Discount Den membership.","{""query_ease"": 0.996508635143816, ""brand_safety"": 0.9727692659123601, ""trustworthiness"": 0.9989988805675857, ""topic_restriction"": 0.9957293011422803, ""context_sufficiency"": 0.996517412935686, ""suspicious_activity"": 0.9965174129374175, ""response_helpfulness"": 0.8058032016326845, ""response_groundedness"": 0.996516774842776}",[],pass,"The agent_output directly answers the query with 'Yes' and explains that different fare types (Standard and GoWild!) can be mixed on the same reservation. It states that all passengers must hold a valid GoWild! Pass at the time of booking and that if Discount Den fares are selected, the primary passenger must hold a Discount Den membership. This aligns with the expected answer and does not contradict it (omitting mention of 'directional basis' is acceptable per criteria). Therefore it meets the criteria."
how long are Frontier vouchers valid?,Most vouchers and credits are valid for 90 days from the date issued. ,"Frontier Airlines vouchers are valid for 90 days from the issue date. They must be redeemed before they expire, but you can book travel for dates as far out as Frontier's schedule allows, which is typically up to 12 months in advance.","{""query_ease"": 0.9965174121994713, ""brand_safety"": 0.996517412936825, ""trustworthiness"": 0.999, ""topic_restriction"": 0.996517412937218, ""context_sufficiency"": 0.9965174129355465, ""suspicious_activity"": 0.9965174129424692, ""response_helpfulness"": 0.9965174059460989, ""response_groundedness"": 0.9965174129355787}",[],pass,"The agent output directly answers the query by stating Frontier vouchers are valid for 90 days from the issue date, which matches the expected answer. It attempts to answer the question (and adds permissible extra info about booking travel dates). It does not contradict the expected answer. Therefore it meets all criteria."
i used part of my voucher on a booking can i use the remaining balance later?,"Some vouchers are one-time use and won’t retain a remaining balance, so if yours is a one-time use voucher any leftover amount would not be available for future use. If you’re unsure whether your voucher is one-time use or need help confirming the balance, visit our troubleshooting page or start a chat with us: https://www.flyfrontier.com/chat-with-us/.","Frontier Airlines vouchers are generally designed for one-time use, meaning that any unused value at the time of booking is not retained and cannot be applied to future reservations. However, there are some voucher types that are reusable until the full value is used. To determine if your voucher allows for multiple uses, you should check the details provided in the email or letter you received with the voucher.","{""query_ease"": 0.9965170722562324, ""brand_safety"": 0.9965170270960219, ""trustworthiness"": 0.9989995851623507, ""topic_restriction"": 0.9965174127725149, ""context_sufficiency"": 0.9965174115596148, ""suspicious_activity"": 0.9965174129384616, ""response_helpfulness"": 0.9964867790566496, ""response_groundedness"": 0.9965174129354645}",[],pass,"The agent output answers the user’s question by stating vouchers are generally one-time use (unused value not retained) while noting some voucher types can be reused and advising to check the voucher details. This aligns with the expected answer (no contradiction) and attempts to resolve the user’s question. Although it does not include the troubleshooting/chat link from the expected answer, that is not required by the criteria. Therefore it meets the criteria."
do i need to book my companion at the same time as me?,"Yes. The companion must be added to the booking at the time of purchase. If you do not add a companion during the initial booking, the companion benefit cannot be applied later.","Yes, you need to book your companion's ticket at the same time as yours. If you do not add a companion during the initial booking, the benefit cannot be applied later.","{""query_ease"": 0.7715115834005885, ""brand_safety"": 0.9965174127257941, ""trustworthiness"": 0.9989998404517361, ""topic_restriction"": 0.996517412792774, ""context_sufficiency"": 0.9965174129354119, ""suspicious_activity"": 0.9965174127994572, ""response_helpfulness"": 0.9965173976553457, ""response_groundedness"": 0.996517412935461}",[],pass,The agent output directly answers the question with 'Yes' and clearly states the companion must be added during the initial booking and that the benefit cannot be applied later. This matches the expected answer and contains no contradictions.
"i already bought my ticket but forgot to add my companion, can the companion benefit be applied now?","No. If you did not add the companion during the initial booking (at the time of purchase), the benefit cannot be applied later. The policy requires the companion to be added at purchase.","The companion travel benefit must be applied at the time of the initial booking. Unfortunately, if you did not add your companion when you first purchased your ticket, the benefit cannot be applied afterward.","{""query_ease"": 0.9963412310884736, ""brand_safety"": 0.9964105233449654, ""trustworthiness"": 0.9989998404517361, ""topic_restriction"": 0.9965174129432304, ""context_sufficiency"": 0.996517412935833, ""suspicious_activity"": 0.9965174129383474, ""response_helpfulness"": 0.996517405949889, ""response_groundedness"": 0.9965174129357988}",[],pass,"The agent output directly answers the user’s question by stating the companion benefit must be added at purchase and cannot be applied later. This matches the expected answer and does not contradict it. The output attempts to answer and does so clearly. Therefore, it meets the criteria."
do i have to post my GoWild trip on social media after flying or is that optional?,"Posting your GoWild! trip on social media is optional. While Frontier Airlines encourages GoWild! Pass holders to share their travel experiences on social media, it is not a requirement. Enjoy your travels with the GoWild! Pass without any obligation to post about it.","Posting your GoWild! trip on social media is optional. While Frontier Airlines encourages GoWild! Pass holders to share their travel experiences on social media, it is not a requirement. Enjoy your travels with the GoWild! Pass as you see fit!","{""query_ease"": 0.9965154542299722, ""brand_safety"": 0.9965174129360899, ""trustworthiness"": 0.9989985640123387, ""topic_restriction"": 0.996517366563869, ""context_sufficiency"": 0.9965174122854921, ""suspicious_activity"": 0.9965173661894547, ""response_helpfulness"": 0.9965174129361404, ""response_groundedness"": 0.9965174129373189}",[],pass,"The agent output directly answers the query by stating that posting a GoWild! trip on social media is optional and that Frontier encourages but does not require sharing—this matches the expected answer and does not contradict it. The output attempts to answer and provides the correct information, so it meets all criteria."
can infants fly free on my lap and what ages are allowed?,"Infants under the age of 2 can fly for free on an adult's lap with Frontier Airlines. However, they must be at least 7 days old to travel. Only one lap infant is allowed per adult. If you are traveling alone with two infants, one must have a paid seat and use an FAA-approved car seat. A birth certificate may be requested for age verification.","Infants under the age of 2 can fly for free on your lap with Frontier Airlines. However, they must be at least 7 days old to travel. Only one lap infant is allowed per adult. If you are traveling alone with two infants, one must have a paid seat and be secured in an FAA-approved car seat. A birth certificate may be requested for age verification.","{""query_ease"": 0.9965029414469565, ""brand_safety"": 0.9965174129358295, ""trustworthiness"": 0.9989999732025197, ""topic_restriction"": 0.9965174129368393, ""context_sufficiency"": 0.9965174129359285, ""suspicious_activity"": 0.9965174129383644, ""response_helpfulness"": 0.9965174027615837, ""response_groundedness"": 0.9965174129353809}",[],pass,"The agent output directly answers the query and matches the expected information: infants under 2 can fly on an adult's lap for free with Frontier; minimum age 7 days; one lap infant per adult; if traveling alone with two infants, one must have a paid seat and use an FAA-approved car seat; birth certificate may be requested. No contradictions and it attempts to answer rather than saying unknown. Therefore it meets the criteria."
"im traveling alone with two infants under 2, can both sit on my lap or what do i need to do?","You cannot have two lap infants with only one adult. Frontier allows only one child per adult lap. If you are the only adult traveling with two infants under age two, you must purchase a ticket for the second child and use an approved car seat for that child. ","When traveling alone with two infants under the age of 2 on Frontier Airlines, you can only have one infant on your lap. The other infant will require a purchased ticket and must be seated in an FAA-approved car seat. This is because only one lap child is allowed per adult. If you need to travel with two infants, you will need to ensure you have an approved car seat for the second child.","{""query_ease"": 0.996517360488634, ""brand_safety"": 0.996517412935998, ""trustworthiness"": 0.9989993196622015, ""topic_restriction"": 0.9965174129382465, ""context_sufficiency"": 0.9965174129355726, ""suspicious_activity"": 0.9965174129370624, ""response_helpfulness"": 0.9965174129298711, ""response_groundedness"": 0.9965174129354678}",[],pass,"The agent output directly answers the query, stating that only one infant may be on an adult's lap and that the second infant requires a purchased ticket and an FAA-approved car seat. This matches the expected answer and does not contradict it. Therefore it meets the criteria."
how do i submit a request to delete my personal information?,"You can submit a verifiable consumer request to delete your personal information in two ways: 1) Use the California Consumer Privacy Policy webform (the California Consumer Privacy Policy Form on flyfrontier.com) or 2) Call Frontier Airlines toll free at 1-800-243-6297. Frontier will ask you to confirm your deletion request before deleting the information and must verify your identity (or your authorized agent’s authority) using information generally provided when booking, such as name, address, birth date, email address and/or flight information. Note: you may only make a verifiable consumer request twice within a 12-month period. Frontier’s policy is to confirm receipt of a request within 10 days and to respond within 45 days (they may extend up to 90 days and will notify you in writing if they need more time).","To submit a request to delete your personal information with Frontier Airlines, you can follow these steps:

1. **Online Form**: Use the [California Consumer Privacy Policy Form](https://www.flyfrontier.com/frontier-consumer-privacy-request-form/) available on Frontier Airlines' website to submit your request.

2. **Phone**: Call Frontier Airlines toll-free at 1-800-243-6297 to make your request.

Only you or an authorized agent registered with the California Secretary of State can make a verifiable consumer request related to your personal information. If you are a *FRONTIER Miles* member or subscribe to Discount Den, be aware that requesting deletion of your personal information will revoke your membership and/or subscription, as Frontier Airlines would not be able to track your membership or mileage activity.","{""query_ease"": 0.9965174128824069, ""brand_safety"": 0.9965174129359212, ""trustworthiness"": 0.9989995851623507, ""topic_restriction"": 0.9965174129364005, ""context_sufficiency"": 0.9965174129354486, ""suspicious_activity"": 0.9965174129380648, ""response_helpfulness"": 0.9965174129238866, ""response_groundedness"": 0.9965174129356718}",[],pass,"The agent output directly answers how to submit a deletion request by providing the two methods from the expected answer: the California Consumer Privacy Policy webform (with link) and the Frontier toll-free number 1-800-243-6297. It also notes that only the consumer or an authorized agent can make the request and warns that deletion will revoke certain memberships—information that does not contradict the expected answer. The response attempts to answer the question (not 'I don't know') and may omit some expected details (identity verification specifics, twice-per-12-month limit, and timing/response window), but omissions are allowed under the criteria as long as nothing contradicts the expected answer. Therefore the output meets all criteria."
